{
  "model_id": "abstraction",
  "source_file": "abstraction_rag.md",
  "allies": [
    {
      "target_model_id": "systems-thinking",
      "rationale_text": "Systems-thinking gives abstraction the whole-machine view that lets high-level models capture interrelationships instead of static detail piles.",
      "source_quote": "Systems thinking is intrinsically allied with abstraction",
      "extraction_type": "explicit",
      "confidence": "high",
      "affinity_strength": 0.9,
      "affinity_rationale": "Described as 'intrinsically allied with abstraction, serving as a discipline for seeing wholes' — strong foundational relationship where systems thinking provides the interrelationship view that makes abstraction productive.",
      "activation_condition": "When modeling complex phenomena and need to see interrelationships and whole-system patterns rather than accumulating static data points"
    },
    {
      "target_model_id": "first-principles-thinking",
      "rationale_text": "First-principles-thinking keeps abstraction honest by rebuilding the model from facts rather than from inherited labels alone.",
      "source_quote": "abstraction conflicts with first-principles-thinking when high-level labels hide untested assumptions",
      "extraction_type": "normalized",
      "confidence": "high",
      "affinity_strength": 0.8,
      "affinity_rationale": "Corrective complement — keeps abstraction honest by rebuilding from facts, but also carries an explicit tension ('high-level labels hide untested assumptions'), indicating a dual-nature relationship rather than pure synergy.",
      "activation_condition": "When inherited high-level categories or labels may mask untested assumptions about the underlying structure that abstraction has preserved uncritically"
    },
    {
      "target_model_id": "simplification",
      "rationale_text": "Simplification is the practical expression of abstraction when complexity is compressed into a clearer structure without losing what matters.",
      "source_quote": "find simplicity in complexity",
      "extraction_type": "normalized",
      "confidence": "high",
      "affinity_strength": 0.8,
      "affinity_rationale": "Framed as an output aptitude of abstraction — 'find simplicity in complexity' — rather than a mechanism that strengthens abstraction itself. The relationship flows from abstraction producing simplification, not simplification powering abstraction.",
      "activation_condition": "When complex systems need to be compressed into clearer structures for communication or action without losing essential relationships"
    }
  ],
  "antagonists": [
    {
      "target_model_id": "theory-induced-blindness",
      "rationale_text": "Theory-induced-blindness corrupts abstraction when the framework becomes a cage that forces reality to fit the model rather than revising the model to fit reality.",
      "source_quote": "torture reality so that it fits your models",
      "extraction_type": "normalized",
      "confidence": "high",
      "affinity_strength": 0.9,
      "affinity_rationale": "Described as 'a primary antagonist' — corrupts abstraction when the framework forces reality to fit the model ('torture reality so that it fits your models') rather than revising the model to fit reality.",
      "activation_condition": "When the abstract framework has become a comfortable lens that forces incoming evidence to conform rather than updating the model when reality diverges"
    }
  ],
  "structured_tensions": [
    {
      "target_model_id": "first-principles-thinking",
      "tension_text": "Abstraction conflicts with first-principles-thinking when high-level labels hide untested assumptions that should have been stripped away before synthesis.",
      "source_quote": "abstraction vs first-principles-thinking: abstraction conflicts with first-principles-thinking (first principles thinking) when high-level labels hide untested assumptions.",
      "extraction_type": "explicit",
      "confidence": "high",
      "tension_type": "conflicts"
    }
  ],
  "curation_notes": {
    "summary": "Layer 1+2 enrichment complete. Allies: systems-thinking 0.90 (strong — 'intrinsically allied'), first-principles-thinking 0.80 (moderate — corrective complement with explicit tension), simplification 0.80 (moderate — output aptitude). Antagonists differentiated: theory-induced-blindness 0.90 (strong — 'a primary antagonist'). Activation conditions assigned to all allies and antagonists.",
    "donor_drops": [
      "Did not preserve donor relation widening beyond the source-backed systems, simplification, and anti-framework-overreach surface."
    ],
    "open_questions": [
      "Analogical-thinking is source-real, but it was omitted because the current graph vocabulary does not expose a matching clean target id."
    ]
  }
}
