{
  "model_id": "sunk-cost-fallacy",
  "source_file": "Sunk_Cost_Fallacy_rag.md",
  "allies": [
    {
      "target_model_id": "first-principles-thinking",
      "rationale_text": "First-principles-thinking helps sunk-cost-fallacy strip away the historical investment and reevaluate the choice from current facts and future outcomes.",
      "source_quote": "This approach ... acts as a powerful antidote to SCF by eliminating the historical premise",
      "extraction_type": "normalized",
      "confidence": "high",
      "affinity_strength": 0.9,
      "affinity_rationale": "Canonical describes first principles as a powerful antidote to SCF by eliminating historical premises from evaluation",
      "activation_condition": "When evaluating investments requires stripping away historical spending to assess only future value"
    },
    {
      "target_model_id": "optionality",
      "rationale_text": "Optionality helps sunk-cost-fallacy preserve reversible alternatives instead of escalating until the decision space closes.",
      "source_quote": "escalation closes reversible alternatives",
      "extraction_type": "normalized",
      "confidence": "high",
      "affinity_strength": 0.8,
      "affinity_rationale": "Optionality supports sunk cost recognition by preserving the ability to exit failing commitments",
      "activation_condition": "When maintaining reversible alternatives prevents escalation of commitment to failing paths"
    },
    {
      "target_model_id": "systems-thinking",
      "rationale_text": "Systems-thinking helps sunk-cost-fallacy see the drift-to-low-performance pattern that comes from continually justifying past action with new exposure.",
      "source_quote": "drift to low performance",
      "extraction_type": "normalized",
      "confidence": "high",
      "affinity_strength": 0.9,
      "affinity_rationale": "Canonical identifies drift to low performance as the systems-level consequence of sunk cost persistence",
      "activation_condition": "When systemic analysis reveals declining standards from continued justification of past actions"
    }
  ],
  "antagonists": [
    {
      "target_model_id": "commitment-bias",
      "rationale_text": "Commitment-bias fuels sunk-cost-fallacy by making prior investment feel like a reason to continue exposure rather than a reason to reevaluate.",
      "source_quote": "prior investment is used to justify continued exposure",
      "extraction_type": "normalized",
      "confidence": "high",
      "affinity_strength": 0.95,
      "affinity_rationale": "Canonical describes commitment/consistency as the active psychological mechanism that forces persistence in sunk cost behavior",
      "activation_condition": "When the drive for consistency with prior decisions forces continued investment despite negative evidence"
    },
    {
      "target_model_id": "confirmation-bias",
      "rationale_text": "Confirmation-bias locks sunk-cost-fallacy in place by filtering for evidence that keeps the original investment looking defensible.",
      "source_quote": "favor information that supports their original investment",
      "extraction_type": "normalized",
      "confidence": "high",
      "affinity_strength": 0.9,
      "affinity_rationale": "Canonical states confirmation bias locks individuals into failing paths by filtering for supporting information",
      "activation_condition": "When selective information filtering supports original investment decisions while discounting disconfirming evidence"
    }
  ],
  "structured_tensions": [
    {
      "target_model_id": "commitment-bias",
      "tension_text": "Sunk-cost-fallacy conflicts with commitment-bias when prior investment is used to justify continued exposure.",
      "source_quote": "sunk-cost-fallacy vs commitment-bias: sunk-cost-fallacy conflicts with commitment-bias (commitment bias) when prior investment is used to justify continued exposure.",
      "extraction_type": "explicit",
      "confidence": "high",
      "tension_type": "conflicts"
    },
    {
      "target_model_id": "optionality",
      "tension_text": "Sunk-cost-fallacy conflicts with optionality when escalation closes reversible alternatives.",
      "source_quote": "sunk-cost-fallacy vs optionality: sunk-cost-fallacy conflicts with optionality (optionality) when escalation closes reversible alternatives.",
      "extraction_type": "explicit",
      "confidence": "high",
      "tension_type": "conflicts"
    },
    {
      "target_model_id": "confirmation-bias",
      "tension_text": "Sunk-cost-fallacy conflicts with confirmation-bias when decision-makers selectively favor information that supports their original investment while discounting disconfirming evidence.",
      "source_quote": "sunk-cost-fallacy vs confirmation-bias: sunk-cost-fallacy conflicts with confirmation-bias (confirmation bias) when decision-makers selectively favor information that supports their original investment while discounting disconfirming evidence.",
      "extraction_type": "explicit",
      "confidence": "high",
      "tension_type": "conflicts"
    }
  ],
  "curation_notes": {
    "summary": "Layer 1+2 enrichment complete. commitment-bias antagonist elevated to 0.95 as canonical describes it as the active mechanism forcing persistence.",
    "donor_drops": [
      "Did not preserve donor relation widening beyond the clearly named anti-escalation neighborhood."
    ],
    "open_questions": [
      "Framing pressure is source-real too, but the retained set favors the three explicit current-vocabulary tension blocks."
    ]
  }
}
