{
  "model_id": "cultural-dimensions-theory",
  "source_file": "Cultural_Dimensions_Theory_rag.md",
  "allies": [
    {
      "target_model_id": "systems-thinking",
      "rationale_text": "Systems-thinking helps cultural-dimensions-theory connect local behavior differences to broader coordination patterns and long-term effects.",
      "source_quote": "Models are invaluable in systems thinking contexts, helping users gain a big-picture view, recognize patterns, and visualize the dynamics of complex systems.",
      "extraction_type": "explicit",
      "confidence": "high",
      "affinity_strength": 0.9,
      "affinity_rationale": "Described as 'essential tools within systems thinking' — models help conceptualize organizations as machines made up of culture and people, tracing cause-and-effect activities within the system.",
      "activation_condition": "When cultural dimensions need to be analyzed as systemic interrelationships within organizational or societal contexts rather than as isolated variables"
    }
  ],
  "antagonists": [
    {
      "target_model_id": "representativeness-heuristic",
      "rationale_text": "Representativeness-heuristic undermines cultural-dimensions-theory by causing users to treat dimension scores as fixed identity labels for individuals rather than probabilistic context clues, collapsing cultural analysis into stereotyping.",
      "source_quote": "The model fails when cultural dimensions are treated as fixed labels for individuals rather than probabilistic context clues that still need verification in the real relationship.",
      "extraction_type": "explicit",
      "confidence": "high",
      "affinity_strength": 0.8,
      "affinity_rationale": "From structured tensions — stereotypes replace context-specific interpretation, causing cultural dimension scores to be applied as fixed categories rather than context-dependent analytical tools.",
      "activation_condition": "When cultural dimension scores are treated as stereotypical predictions rather than probabilistic tools requiring context-specific calibration"
    }
  ],
  "structured_tensions": [
    {
      "target_model_id": "optionality",
      "tension_text": "Cultural-dimensions-theory conflicts with optionality when broad cultural branching postpones concrete coordination commitments that now need closure.",
      "source_quote": "cultural-dimensions-theory conflicts with optionality (optionality) when broad cultural branching postpones concrete coordination commitments.",
      "extraction_type": "explicit",
      "confidence": "high",
      "tension_type": "conflicts"
    },
    {
      "target_model_id": "opportunity-cost",
      "tension_text": "Cultural-dimensions-theory conflicts with opportunity-cost when adapting to one norm set hides the outcomes foregone in alternative contexts.",
      "source_quote": "cultural-dimensions-theory conflicts with opportunity-cost (opportunity cost) when adaptation to one norm set masks foregone outcomes in alternative contexts.",
      "extraction_type": "explicit",
      "confidence": "high",
      "tension_type": "conflicts"
    }
  ],
  "curation_notes": {
    "summary": "Layer 1+2 enrichment complete. Allies: systems-thinking 0.90 (strong — 'essential tools within systems thinking'). Antagonist: representativeness-heuristic 0.80 (moderate — stereotypes replace context-specific interpretation). Activation conditions assigned. SPARSE_ALLY_RECOVERY: only 1 ally — high priority.",
    "donor_drops": [
      "Did not keep donor-shaped or out-of-vocabulary relation surfaces; omission beat weak forcing."
    ],
    "open_questions": [
      "Higher-order candidates remain observational only and belong in later selective review rather than in this closure batch.",
      "SPARSE_ALLY_RECOVERY: only 1 ally curated — high priority. Canonical article names cognitive-load-theory, emotional-intelligence (ToM), and logical-decomposition as additional synergistic allies."
    ]
  },
  "deferred_higher_order_notes": {
    "allies": [
      "Wave 4 candidacy remains observational only for this model."
    ],
    "antagonists": [
      "Any broader antagonistic surface not preserved here was omitted because the current first-order vocabulary did not justify forcing it."
    ],
    "structured_tensions": [
      "Only explicit or cleanly source-supported tensions that survive current-vocabulary discipline were preserved."
    ]
  }
}
