{
  "model_id": "schema-acquisition",
  "source_file": "Schema_Acquisition_rag.md",
  "allies": [
    {
      "target_model_id": "cognitive-load-theory",
      "rationale_text": "Cognitive-load-theory supports schema-acquisition by reducing working-memory strain so chunking and scaffolding can build stable mental structure.",
      "source_quote": "CLT emphasizes optimizing the learning environment to reduce strain on working memory, which frees up capacity for the encoding process necessary for schema formation.",
      "extraction_type": "normalized",
      "confidence": "high",
      "affinity_strength": 0.9,
      "affinity_rationale": "Canonical: 'CLT emphasizes optimizing the learning environment to reduce strain on working memory, which frees up capacity for the encoding process necessary for schema formation.'",
      "activation_condition": "When reducing cognitive load is needed to free working memory capacity for the encoding process that builds durable schemas."
    },
    {
      "target_model_id": "abstraction",
      "rationale_text": "Abstraction helps schema-acquisition compress detail into a usable map without losing the underlying structure people need to retrieve later.",
      "source_quote": "Schemas are conceptual maps-deliberately organized, abstracted, and simplified visions of a complex intellectual landscape.",
      "extraction_type": "normalized",
      "confidence": "high",
      "affinity_strength": 0.8,
      "affinity_rationale": "Moderate: schemas ARE abstractions — 'deliberately organized, abstracted, and simplified visions of a complex intellectual landscape.' Schema acquisition is the process of building useful abstractions.",
      "activation_condition": "When building mental models requires abstracting complex reality into simplified, organized representations that enable pattern recognition."
    }
  ],
  "antagonists": [
    {
      "target_model_id": "einstellung-effect",
      "rationale_text": "Einstellung-effect undermines schema-acquisition by causing the learner to persist with the first recognized pattern instead of encoding a better-fitting schema for the novel situation.",
      "source_quote": "Cognitive Entrenchment (The 'Seen This Before' Error): Assuming that a genuinely novel problem is merely a variation of a problem solved previously, causing problem solvers to incorrectly persist in using unhelpful or misleading schemas.",
      "extraction_type": "normalized",
      "confidence": "high",
      "affinity_strength": 0.8,
      "affinity_rationale": "Canonical (as Availability Heuristic): 'prevents deliberate schema acquisition by substituting a simpler, known model for the complex actual model needed.'",
      "activation_condition": "When familiar schemas are applied reflexively to novel problems, preventing acquisition of more appropriate new schemas."
    }
  ],
  "structured_tensions": [
    {
      "target_model_id": "representativeness-heuristic",
      "tension_text": "Schema-acquisition conflicts with representativeness-heuristic when familiar pattern labels replace context-specific diagnosis.",
      "source_quote": "schema-acquisition vs representativeness-heuristic: schema-acquisition conflicts with representativeness-heuristic (representativeness bias) when familiar pattern labels replace context-specific diagnosis.",
      "extraction_type": "explicit",
      "confidence": "high",
      "tension_type": "conflicts"
    },
    {
      "target_model_id": "first-principles-thinking",
      "tension_text": "Schema-acquisition conflicts with first-principles-thinking when overlearned templates block reconstruction from base facts.",
      "source_quote": "schema-acquisition vs first-principles-thinking: schema-acquisition conflicts with first-principles-thinking (first principles thinking) when overlearned templates block reconstruction from base facts.",
      "extraction_type": "explicit",
      "confidence": "high",
      "tension_type": "conflicts"
    },
    {
      "target_model_id": "anchoring",
      "tension_text": "Schema-acquisition conflicts with anchoring when the first schema encountered creates a reference point that distorts evaluation of a better-fitting schema.",
      "source_quote": "schema-acquisition vs anchoring: schema-acquisition conflicts with anchoring (anchoring) when the first schema encountered creates a reference point that distorts the evaluation of subsequent, potentially better-fitting schemas.",
      "extraction_type": "explicit",
      "confidence": "high",
      "tension_type": "conflicts"
    }
  ],
  "curation_notes": {
    "summary": "Layer 1+2 enrichment complete. cognitive-load-theory at 0.90 (frees encoding capacity), abstraction at 0.80 (schemas are abstractions). einstellung antagonist at 0.80. Canonical also lists analogies-and-metaphors and systems-thinking as allies.",
    "donor_drops": [
      "Did not preserve broader communication or design-thinking relation sprawl beyond the cleanest current-vocabulary supports and tensions."
    ],
    "open_questions": [
      "Circle-of-competence is source-real in the risk section, but the current first-order relation surface is cleaner around the explicit tension block.",
      "SPARSE_ALLY_RECOVERY: 2 curated allies. Canonical allies include analogies-and-metaphors (rapid transfer via existing schemas), systems-thinking (schemas interpret component interactions), design-thinking (acquiring human-centered schemas)."
    ]
  }
}
